product_id,product_name,category,material,carbon_footprint_g,water_usage_L,recycled_content_pct,packaging_type,certifications,price_usd,manufacturer_country,eco_score,carbon_footprint_score,recyclability_score,packaging_score,sustainability_index,sustainability_index_normalized,raw_price_usd,product_description
218,Cork Cutting Board,Home Goods,Cork,605,988,80,Compostable Bag,None,0.3219136013103119,China,0.0,4.432515337423313,3.1,5.0,2.949754601226994,64.66348952937841,50.22,Product Name: Cork Cutting Board. Category: Home Goods. Material: Cork. Packaging: Compostable Bag. Manufactured in: China. Eco Score: 0.0/5. Carbon Footprint Score: 4.4/5. Recyclability Score: 3.1/5. Packaging Score: 5.0/5. Overall Sustainability Index: 64.7/100.
219,Local Fruits Dried Fruit Mix,Food,Local Fruits,478,300,80,Glass Jar,None,0.12393366546099775,USA,0.0,4.56237218813906,3.1,3.0,2.588711656441718,54.725668408009696,21.21,Product Name: Local Fruits Dried Fruit Mix. Category: Food. Material: Local Fruits. Packaging: Glass Jar. Manufactured in: USA. Eco Score: 0.0/5. Carbon Footprint Score: 4.6/5. Recyclability Score: 3.1/5. Packaging Score: 3.0/5. Overall Sustainability Index: 54.7/100.
220,Vegan Leather Boots,Footwear,Vegan Leather,2498,5225,100,Plastic Film,Fair Trade,0.24179348938783865,France,0.1825383448508342,2.4969325153374236,2.0,1.0,1.4038412580564772,22.111736350258475,38.48,Product Name: Vegan Leather Boots. Category: Footwear. Material: Vegan Leather. Packaging: Plastic Film. Manufactured in: France. Eco Score: 0.2/5. Carbon Footprint Score: 2.5/5. Recyclability Score: 2.0/5. Packaging Score: 1.0/5. Overall Sustainability Index: 22.1/100.
221,Glass Coffee Mug,Home Goods,Glass,1021,338,50,None,Fair Trade,0.4882276666894152,France,2.418085285690207,4.007157464212679,3.5,5.0,3.627572824970866,83.32065028452521,74.59,Product Name: Glass Coffee Mug. Category: Home Goods. Material: Glass. Packaging: None. Manufactured in: France. Eco Score: 2.4/5. Carbon Footprint Score: 4.0/5. Recyclability Score: 3.5/5. Packaging Score: 5.0/5. Overall Sustainability Index: 83.3/100.
222,Natural Latex Running Shoes,Footwear,Natural Latex,1701,2048,0,Glass Jar,None,0.5589981573739166,Portugal,0.0,3.3118609406952966,1.5,3.0,1.893558282208589,35.59135215886288,84.96,Product Name: Natural Latex Running Shoes. Category: Footwear. Material: Natural Latex. Packaging: Glass Jar. Manufactured in: Portugal. Eco Score: 0.0/5. Carbon Footprint Score: 3.3/5. Recyclability Score: 1.5/5. Packaging Score: 3.0/5. Overall Sustainability Index: 35.6/100.
223,Organic Aloe Lip Balm,Personal Care,Organic Aloe,61,297,80,Glass Jar,USDA Organic,0.0221115130007507,Brazil,3.4284510365750887,4.988752556237219,3.1,3.0,3.7451610778436923,86.5573040951111,6.29,Product Name: Organic Aloe Lip Balm. Category: Personal Care. Material: Organic Aloe. Packaging: Glass Jar. Manufactured in: Brazil. Eco Score: 3.4/5. Carbon Footprint Score: 5.0/5. Recyclability Score: 3.1/5. Packaging Score: 3.0/5. Overall Sustainability Index: 86.6/100.
224,Cork Boots,Footwear,Cork,842,5349,20,Compostable Bag,GRS,0.5133419777519962,China,0.0,4.190184049079755,1.9,5.0,2.6370552147239263,56.05634012315643,78.27,Product Name: Cork Boots. Category: Footwear. Material: Cork. Packaging: Compostable Bag. Manufactured in: China. Eco Score: 0.0/5. Carbon Footprint Score: 4.2/5. Recyclability Score: 1.9/5. Packaging Score: 5.0/5. Overall Sustainability Index: 56.1/100.
225,Bamboo Fiber Solar Charger,Electronics,Bamboo Fiber,2141,2929,0,Recyclable Cardboard,RoHS,0.9984986009690848,Kenya,1.26302039440418,2.861963190184049,1.5,3.0,2.137495075376469,42.30578945901415,149.36,Product Name: Bamboo Fiber Solar Charger. Category: Electronics. Material: Bamboo Fiber. Packaging: Recyclable Cardboard. Manufactured in: Kenya. Eco Score: 1.3/5. Carbon Footprint Score: 2.9/5. Recyclability Score: 1.5/5. Packaging Score: 3.0/5. Overall Sustainability Index: 42.3/100.
226,Linen T-Shirt,Apparel,Linen,1979,5285,0,None,OEKO-TEX,0.27175322459564594,India,0.6673689533119838,3.0276073619631907,1.5,5.0,2.4084928945825523,49.76509005039606,42.87,Product Name: Linen T-Shirt. Category: Apparel. Material: Linen. Packaging: None. Manufactured in: India. Eco Score: 0.7/5. Carbon Footprint Score: 3.0/5. Recyclability Score: 1.5/5. Packaging Score: 5.0/5. Overall Sustainability Index: 49.8/100.
227,Organic Oats Granola Bar,Food,Organic Oats,150,368,0,Glass Jar,None,0.04033303760322119,Japan,1.910500589920782,4.897750511247444,1.5,3.0,2.9424753303504674,64.46312529872455,8.96,Product Name: Organic Oats Granola Bar. Category: Food. Material: Organic Oats. Packaging: Glass Jar. Manufactured in: Japan. Eco Score: 1.9/5. Carbon Footprint Score: 4.9/5. Recyclability Score: 1.5/5. Packaging Score: 3.0/5. Overall Sustainability Index: 64.5/100.
228,Organic Cocoa Quinoa Pack,Food,Organic Cocoa,532,16,50,Plastic Bag,None,0.09649901044154781,Germany,1.9994943536153718,4.507157464212678,1.0,1.0,2.3519955453484154,48.20998266322839,17.19,Product Name: Organic Cocoa Quinoa Pack. Category: Food. Material: Organic Cocoa. Packaging: Plastic Bag. Manufactured in: Germany. Eco Score: 2.0/5. Carbon Footprint Score: 4.5/5. Recyclability Score: 1.0/5. Packaging Score: 1.0/5. Overall Sustainability Index: 48.2/100.
229,Organic Herbs Solid Shampoo Bar,Personal Care,Organic Herbs,454,255,80,Plastic Bag,USDA Organic,0.14529447894629086,Vietnam,3.439069610652284,4.586912065439673,1.6,1.0,2.927794502827587,64.05903088296793,24.34,Product Name: Organic Herbs Solid Shampoo Bar. Category: Personal Care. Material: Organic Herbs. Packaging: Plastic Bag. Manufactured in: Vietnam. Eco Score: 3.4/5. Carbon Footprint Score: 4.6/5. Recyclability Score: 1.6/5. Packaging Score: 1.0/5. Overall Sustainability Index: 64.1/100.
230,Clay Bento Box,Home Goods,Clay,441,542,95,None,FSC,0.5136149593939808,India,1.3665093544581155,4.600204498977504,3.4,5.0,3.470014156030686,78.98379814362633,78.31,Product Name: Clay Bento Box. Category: Home Goods. Material: Clay. Packaging: None. Manufactured in: India. Eco Score: 1.4/5. Carbon Footprint Score: 4.6/5. Recyclability Score: 3.4/5. Packaging Score: 5.0/5. Overall Sustainability Index: 79.0/100.
231,Shea Butter Reusable Makeup Pads,Personal Care,Shea Butter,444,200,0,None,Fair Trade,0.09165358629632157,USA,1.4529748862295635,4.597137014314928,1.5,5.0,3.115033570163347,69.21284536678604,16.48,Product Name: Shea Butter Reusable Makeup Pads. Category: Personal Care. Material: Shea Butter. Packaging: None. Manufactured in: USA. Eco Score: 1.5/5. Carbon Footprint Score: 4.6/5. Recyclability Score: 1.5/5. Packaging Score: 5.0/5. Overall Sustainability Index: 69.2/100.
232,Organic Aloe Reusable Makeup Pads,Personal Care,Organic Aloe,276,242,95,Plastic Bag,None,0.11280966355012624,Germany,1.9423563121523681,4.768916155419223,1.9,1.0,2.5933817402714774,54.854213940867425,19.58,Product Name: Organic Aloe Reusable Makeup Pads. Category: Personal Care. Material: Organic Aloe. Packaging: Plastic Bag. Manufactured in: Germany. Eco Score: 1.9/5. Carbon Footprint Score: 4.8/5. Recyclability Score: 1.9/5. Packaging Score: 1.0/5. Overall Sustainability Index: 54.9/100.
233,Clay Reusable Straws,Home Goods,Clay,391,66,100,Compostable Bag,FSC,0.3621101480925408,USA,1.486853193999663,4.651329243353784,3.5,5.0,3.541454731206034,80.95022254591603,56.11,Product Name: Clay Reusable Straws. Category: Home Goods. Material: Clay. Packaging: Compostable Bag. Manufactured in: USA. Eco Score: 1.5/5. Carbon Footprint Score: 4.7/5. Recyclability Score: 3.5/5. Packaging Score: 5.0/5. Overall Sustainability Index: 81.0/100.
234,Cork Bento Box,Home Goods,Cork,431,838,50,Paper Box,FSC,0.44161605132054876,Kenya,1.2916736895331198,4.610429447852761,1.5,2.0,2.4706309412157643,51.475459415567805,67.76,Product Name: Cork Bento Box. Category: Home Goods. Material: Cork. Packaging: Paper Box. Manufactured in: Kenya. Eco Score: 1.3/5. Carbon Footprint Score: 4.6/5. Recyclability Score: 1.5/5. Packaging Score: 2.0/5. Overall Sustainability Index: 51.5/100.
235,Recycled Plastic LED Desk Lamp,Electronics,Recycled Plastic,4014,1939,87,Plastic Film,Energy Star,0.9928342318979048,Vietnam,2.513315354795213,0.946830265848671,2.74,1.0,1.7860436861931652,32.63197893589919,148.53,Product Name: Recycled Plastic LED Desk Lamp. Category: Electronics. Material: Recycled Plastic. Packaging: Plastic Film. Manufactured in: Vietnam. Eco Score: 2.5/5. Carbon Footprint Score: 0.9/5. Recyclability Score: 2.7/5. Packaging Score: 1.0/5. Overall Sustainability Index: 32.6/100.
236,Bamboo Fiber Lip Balm,Personal Care,Bamboo Fiber,484,417,0,Plastic Film,Fair Trade,0.019040469528424215,USA,3.3981122534973873,4.556237218813906,0.0,1.0,2.586304841693388,54.659420071664556,5.84,Product Name: Bamboo Fiber Lip Balm. Category: Personal Care. Material: Bamboo Fiber. Packaging: Plastic Film. Manufactured in: USA. Eco Score: 3.4/5. Carbon Footprint Score: 4.6/5. Recyclability Score: 0.0/5. Packaging Score: 1.0/5. Overall Sustainability Index: 54.7/100.
237,Ancient Grains Coffee Beans,Food,Ancient Grains,485,408,95,Compostable Bag,None,0.17327509724970996,Brazil,0.0,4.5552147239263805,3.4,5.0,3.046564417177914,67.32821029905044,28.44,Product Name: Ancient Grains Coffee Beans. Category: Food. Material: Ancient Grains. Packaging: Compostable Bag. Manufactured in: Brazil. Eco Score: 0.0/5. Carbon Footprint Score: 4.6/5. Recyclability Score: 3.4/5. Packaging Score: 5.0/5. Overall Sustainability Index: 67.3/100.
238,Aluminum Solar Powerbank,Electronics,Aluminum,3537,1843,0,Compostable Bag,Energy Star,0.5117723333105849,India,0.537586381257374,1.4345603271983642,2.5,5.0,2.0916440125367215,41.04372446838805,78.04,Product Name: Aluminum Solar Powerbank. Category: Electronics. Material: Aluminum. Packaging: Compostable Bag. Manufactured in: India. Eco Score: 0.5/5. Carbon Footprint Score: 1.4/5. Recyclability Score: 2.5/5. Packaging Score: 5.0/5. Overall Sustainability Index: 41.0/100.
239,Organic Oats Dried Fruit Mix,Food,Organic Oats,512,443,0,Plastic Film,USDA Organic,0.0015696444414113149,France,3.391538850497219,4.52760736196319,0.0,1.0,2.575743863738123,54.36872581686182,3.28,Product Name: Organic Oats Dried Fruit Mix. Category: Food. Material: Organic Oats. Packaging: Plastic Film. Manufactured in: France. Eco Score: 3.4/5. Carbon Footprint Score: 4.5/5. Recyclability Score: 0.0/5. Packaging Score: 1.0/5. Overall Sustainability Index: 54.4/100.
240,Organic Oats Herbal Tea Bag,Food,Organic Oats,419,275,0,None,USDA Organic,0.14686412338770216,Kenya,3.4340131468060004,4.622699386503068,1.5,5.0,3.71701375999272,85.78254027853625,24.57,Product Name: Organic Oats Herbal Tea Bag. Category: Food. Material: Organic Oats. Packaging: None. Manufactured in: Kenya. Eco Score: 3.4/5. Carbon Footprint Score: 4.6/5. Recyclability Score: 1.5/5. Packaging Score: 5.0/5. Overall Sustainability Index: 85.8/100.
241,Recycled Aluminum Cutting Board,Home Goods,Recycled Aluminum,721,832,88,Paper Box,FSC,0.10038899883982802,Germany,3.2931906286870047,4.313905930470348,3.26,2.0,3.3341289677472057,75.24351540521728,17.76,Product Name: Recycled Aluminum Cutting Board. Category: Home Goods. Material: Recycled Aluminum. Packaging: Paper Box. Manufactured in: Germany. Eco Score: 3.3/5. Carbon Footprint Score: 4.3/5. Recyclability Score: 3.3/5. Packaging Score: 2.0/5. Overall Sustainability Index: 75.2/100.
242,Linen T-Shirt,Apparel,Linen,2449,3837,100,Plastic Bag,Fair Trade,0.27775882071930663,Kenya,1.533456935782909,2.5470347648261757,2.0,1.0,1.8241475101827251,33.68079872954886,43.75,Product Name: Linen T-Shirt. Category: Apparel. Material: Linen. Packaging: Plastic Bag. Manufactured in: Kenya. Eco Score: 1.5/5. Carbon Footprint Score: 2.5/5. Recyclability Score: 2.0/5. Packaging Score: 1.0/5. Overall Sustainability Index: 33.7/100.
243,Fair Trade Coffee Quinoa Pack,Food,Fair Trade Coffee,171,41,95,Plastic Bag,USDA Organic,0.05807684433221867,Japan,1.4931737738075173,4.876278118609407,1.9,1.0,2.4908355677250773,52.031598143588184,11.56,Product Name: Fair Trade Coffee Quinoa Pack. Category: Food. Material: Fair Trade Coffee. Packaging: Plastic Bag. Manufactured in: Japan. Eco Score: 1.5/5. Carbon Footprint Score: 4.9/5. Recyclability Score: 1.9/5. Packaging Score: 1.0/5. Overall Sustainability Index: 52.0/100.
244,Organic Oats Quinoa Pack,Food,Organic Oats,351,369,0,Plastic Film,Fair Trade,0.10243636115471233,India,3.410247766728468,4.692229038854806,0.0,1.0,2.6307430416749824,55.88259556574696,18.06,Product Name: Organic Oats Quinoa Pack. Category: Food. Material: Organic Oats. Packaging: Plastic Film. Manufactured in: India. Eco Score: 3.4/5. Carbon Footprint Score: 4.7/5. Recyclability Score: 0.0/5. Packaging Score: 1.0/5. Overall Sustainability Index: 55.9/100.
245,Aluminum Eco Phone Case,Electronics,Aluminum,4088,712,95,None,RoHS,0.7691257762915444,Germany,0.0,0.8711656441717791,4.4,5.0,2.141349693251534,42.411889033834555,115.75,Product Name: Aluminum Eco Phone Case. Category: Electronics. Material: Aluminum. Packaging: None. Manufactured in: Germany. Eco Score: 0.0/5. Carbon Footprint Score: 0.9/5. Recyclability Score: 4.4/5. Packaging Score: 5.0/5. Overall Sustainability Index: 42.4/100.
246,Recycled Copper LED Desk Lamp,Electronics,Recycled Copper,2876,1014,86,Paper Box,RoHS,0.4036033576741964,India,1.747176807685825,2.110429447852761,3.2199999999999998,2.0,2.2012818766615756,44.061541316878824,62.19,Product Name: Recycled Copper LED Desk Lamp. Category: Electronics. Material: Recycled Copper. Packaging: Paper Box. Manufactured in: India. Eco Score: 1.7/5. Carbon Footprint Score: 2.1/5. Recyclability Score: 3.2/5. Packaging Score: 2.0/5. Overall Sustainability Index: 44.1/100.
247,Organic Oats Dried Fruit Mix,Food,Organic Oats,235,153,95,Paper Box,None,0.14925271275506724,Japan,1.9648575762683296,4.810838445807771,2.4,2.0,2.9127088066228297,63.643792328830415,24.92,Product Name: Organic Oats Dried Fruit Mix. Category: Food. Material: Organic Oats. Packaging: Paper Box. Manufactured in: Japan. Eco Score: 2.0/5. Carbon Footprint Score: 4.8/5. Recyclability Score: 2.4/5. Packaging Score: 2.0/5. Overall Sustainability Index: 63.6/100.
248,Recycled Plastic Eco Phone Case,Electronics,Recycled Plastic,4020,1928,81,Glass Jar,None,0.775131372415205,Kenya,1.516096409910669,0.9406952965235171,4.12,3.0,2.161037511930256,42.95380246304016,116.63,Product Name: Recycled Plastic Eco Phone Case. Category: Electronics. Material: Recycled Plastic. Packaging: Glass Jar. Manufactured in: Kenya. Eco Score: 1.5/5. Carbon Footprint Score: 0.9/5. Recyclability Score: 4.1/5. Packaging Score: 3.0/5. Overall Sustainability Index: 43.0/100.
249,Tencel Sweater,Apparel,Tencel,1033,3649,95,None,Fair Trade,0.6834777861188835,Brazil,0.5809876959379741,3.994887525562372,3.4,5.0,3.0527625664501037,67.49881631598062,103.2,Product Name: Tencel Sweater. Category: Apparel. Material: Tencel. Packaging: None. Manufactured in: Brazil. Eco Score: 0.6/5. Carbon Footprint Score: 4.0/5. Recyclability Score: 3.4/5. Packaging Score: 5.0/5. Overall Sustainability Index: 67.5/100.
250,Recycled Rubber Sandals,Footwear,Recycled Rubber,1386,4983,98,Compostable Bag,GRS,0.1882208421483655,France,1.7437215573908647,3.6339468302658484,4.46,5.0,3.5053005162970137,79.95506635815823,30.63,Product Name: Recycled Rubber Sandals. Category: Footwear. Material: Recycled Rubber. Packaging: Compostable Bag. Manufactured in: France. Eco Score: 1.7/5. Carbon Footprint Score: 3.6/5. Recyclability Score: 4.5/5. Packaging Score: 5.0/5. Overall Sustainability Index: 80.0/100.
251,Organic Aloe Reusable Makeup Pads,Personal Care,Organic Aloe,585,236,80,Glass Jar,Fair Trade,0.025046065652084896,Brazil,3.443873251306253,4.452965235173824,3.1,3.0,3.5890515459440233,82.26033990908562,6.72,Product Name: Organic Aloe Reusable Makeup Pads. Category: Personal Care. Material: Organic Aloe. Packaging: Glass Jar. Manufactured in: Brazil. Eco Score: 3.4/5. Carbon Footprint Score: 4.5/5. Recyclability Score: 3.1/5. Packaging Score: 3.0/5. Overall Sustainability Index: 82.3/100.
252,Natural Latex Sandals,Footwear,Natural Latex,1880,3320,50,Compostable Bag,Fair Trade,0.5030369207670785,Brazil,0.6641665262093377,3.1288343558282206,2.5,5.0,2.6379002646112673,56.079600388286444,76.76,Product Name: Natural Latex Sandals. Category: Footwear. Material: Natural Latex. Packaging: Compostable Bag. Manufactured in: Brazil. Eco Score: 0.7/5. Carbon Footprint Score: 3.1/5. Recyclability Score: 2.5/5. Packaging Score: 5.0/5. Overall Sustainability Index: 56.1/100.
253,Vegan Leather Sandals,Footwear,Vegan Leather,1699,4959,80,Paper Box,Fair Trade,0.5140244318569577,Vietnam,0.2497893140064047,3.313905930470348,2.1,2.0,1.8891085733430257,35.46887251651885,78.37,Product Name: Vegan Leather Sandals. Category: Footwear. Material: Vegan Leather. Packaging: Paper Box. Manufactured in: Vietnam. Eco Score: 0.2/5. Carbon Footprint Score: 3.3/5. Recyclability Score: 2.1/5. Packaging Score: 2.0/5. Overall Sustainability Index: 35.5/100.
254,Reclaimed Wood Bath Towel,Home Goods,Reclaimed Wood,410,455,95,Plastic Film,None,0.37964921859004985,USA,0.8885049721894488,4.631901840490798,1.9,1.0,2.236122043804074,45.02052792470924,58.68,Product Name: Reclaimed Wood Bath Towel. Category: Home Goods. Material: Reclaimed Wood. Packaging: Plastic Film. Manufactured in: USA. Eco Score: 0.9/5. Carbon Footprint Score: 4.6/5. Recyclability Score: 1.9/5. Packaging Score: 1.0/5. Overall Sustainability Index: 45.0/100.
255,Recycled Aluminum Cutting Board,Home Goods,Recycled Aluminum,631,734,80,Paper Box,None,0.11785982392684091,Brazil,1.817967301533794,4.4059304703476485,3.1,2.0,2.8871693315644325,62.94081020903036,20.32,Product Name: Recycled Aluminum Cutting Board. Category: Home Goods. Material: Recycled Aluminum. Packaging: Paper Box. Manufactured in: Brazil. Eco Score: 1.8/5. Carbon Footprint Score: 4.4/5. Recyclability Score: 3.1/5. Packaging Score: 2.0/5. Overall Sustainability Index: 62.9/100.
256,Cork Bed Sheets,Home Goods,Cork,1341,862,80,None,None,0.13028048863713915,France,0.0,3.679959100204499,3.1,5.0,2.7239877300613498,58.44918507285558,22.14,Product Name: Cork Bed Sheets. Category: Home Goods. Material: Cork. Packaging: None. Manufactured in: France. Eco Score: 0.0/5. Carbon Footprint Score: 3.7/5. Recyclability Score: 3.1/5. Packaging Score: 5.0/5. Overall Sustainability Index: 58.4/100.
257,Fair Trade Coffee Granola Bar,Food,Fair Trade Coffee,449,334,20,Plastic Film,Fair Trade,0.03364498737459906,Vietnam,1.419096578459464,4.5920245398773005,0.4,1.0,2.0833363355010293,40.815053033293495,7.98,Product Name: Fair Trade Coffee Granola Bar. Category: Food. Material: Fair Trade Coffee. Packaging: Plastic Film. Manufactured in: Vietnam. Eco Score: 1.4/5. Carbon Footprint Score: 4.6/5. Recyclability Score: 0.4/5. Packaging Score: 1.0/5. Overall Sustainability Index: 40.8/100.
258,Reclaimed Wood Dinner Set,Home Goods,Reclaimed Wood,453,679,80,Paper Box,None,0.17784753975295162,USA,0.8318725771110737,4.587934560327199,2.1,2.0,2.4459421412314817,50.7958923959409,29.11,Product Name: Reclaimed Wood Dinner Set. Category: Home Goods. Material: Reclaimed Wood. Packaging: Paper Box. Manufactured in: USA. Eco Score: 0.8/5. Carbon Footprint Score: 4.6/5. Recyclability Score: 2.1/5. Packaging Score: 2.0/5. Overall Sustainability Index: 50.8/100.
259,Coconut Oil Organic Soap,Personal Care,Coconut Oil,351,419,95,Paper Box,Fair Trade,0.16044496007643486,Kenya,1.397606607112759,4.692229038854806,2.4,2.0,2.706950693790269,57.98023526689562,26.56,Product Name: Coconut Oil Organic Soap. Category: Personal Care. Material: Coconut Oil. Packaging: Paper Box. Manufactured in: Kenya. Eco Score: 1.4/5. Carbon Footprint Score: 4.7/5. Recyclability Score: 2.4/5. Packaging Score: 2.0/5. Overall Sustainability Index: 58.0/100.
260,Shea Butter Lip Balm,Personal Care,Shea Butter,405,79,0,None,USDA Organic,0.11594895243294888,Kenya,1.4835664924995786,4.637014314928425,1.5,5.0,3.1361742422284014,69.79474904445789,20.04,Product Name: Shea Butter Lip Balm. Category: Personal Care. Material: Shea Butter. Packaging: None. Manufactured in: Kenya. Eco Score: 1.5/5. Carbon Footprint Score: 4.6/5. Recyclability Score: 1.5/5. Packaging Score: 5.0/5. Overall Sustainability Index: 69.8/100.
261,Reclaimed Wood Dinner Set,Home Goods,Reclaimed Wood,1008,231,0,None,FSC,0.15505357264723946,Brazil,2.445137367267824,4.020449897750511,1.5,5.0,3.2396761795055005,72.64367256790929,25.77,Product Name: Reclaimed Wood Dinner Set. Category: Home Goods. Material: Reclaimed Wood. Packaging: None. Manufactured in: Brazil. Eco Score: 2.4/5. Carbon Footprint Score: 4.0/5. Recyclability Score: 1.5/5. Packaging Score: 5.0/5. Overall Sustainability Index: 72.6/100.
262,Hemp Sweater,Apparel,Hemp,2231,1875,0,None,Fair Trade,0.11349211765508768,India,2.0294960391033205,2.7699386503067487,1.5,5.0,2.739830406823021,58.885259755978915,19.68,Product Name: Hemp Sweater. Category: Apparel. Material: Hemp. Packaging: None. Manufactured in: India. Eco Score: 2.0/5. Carbon Footprint Score: 2.8/5. Recyclability Score: 1.5/5. Packaging Score: 5.0/5. Overall Sustainability Index: 58.9/100.
263,Recycled Copper Eco Phone Case,Electronics,Recycled Copper,1704,1081,90,Plastic Bag,RoHS,0.20555517641438614,China,1.7302376538007753,3.3087934560327197,2.8,1.0,2.271709332950049,46.000079301727446,33.17,Product Name: Recycled Copper Eco Phone Case. Category: Electronics. Material: Recycled Copper. Packaging: Plastic Bag. Manufactured in: China. Eco Score: 1.7/5. Carbon Footprint Score: 3.3/5. Recyclability Score: 2.8/5. Packaging Score: 1.0/5. Overall Sustainability Index: 46.0/100.
264,Local Fruits Quinoa Pack,Food,Local Fruits,245,187,20,Compostable Bag,None,0.07541117859823927,France,0.0,4.800613496932515,1.9,5.0,2.8201840490797543,61.09701914563487,14.1,Product Name: Local Fruits Quinoa Pack. Category: Food. Material: Local Fruits. Packaging: Compostable Bag. Manufactured in: France. Eco Score: 0.0/5. Carbon Footprint Score: 4.8/5. Recyclability Score: 1.9/5. Packaging Score: 5.0/5. Overall Sustainability Index: 61.1/100.
265,Reclaimed Wood Coffee Mug,Home Goods,Reclaimed Wood,691,937,95,Glass Jar,None,0.17170545280829863,Vietnam,0.7666441934940165,4.344580777096114,3.4,3.0,2.8133674911770394,60.909391235772446,28.21,Product Name: Reclaimed Wood Coffee Mug. Category: Home Goods. Material: Reclaimed Wood. Packaging: Glass Jar. Manufactured in: Vietnam. Eco Score: 0.8/5. Carbon Footprint Score: 4.3/5. Recyclability Score: 3.4/5. Packaging Score: 3.0/5. Overall Sustainability Index: 60.9/100.
266,Clay Bath Towel,Home Goods,Clay,1183,354,100,Compostable Bag,FSC,0.26909165358629633,Portugal,1.4140401146131805,3.841513292433538,3.5,5.0,3.2766660221140156,73.66182967209984,42.48,Product Name: Clay Bath Towel. Category: Home Goods. Material: Clay. Packaging: Compostable Bag. Manufactured in: Portugal. Eco Score: 1.4/5. Carbon Footprint Score: 3.8/5. Recyclability Score: 3.5/5. Packaging Score: 5.0/5. Overall Sustainability Index: 73.7/100.
267,Organic Oats Dried Fruit Mix,Food,Organic Oats,539,336,80,Paper Box,USDA Organic,0.12563980072340136,USA,3.4185909320748356,4.5,2.1,2.0,3.19557727962245,71.42983641623614,21.46,Product Name: Organic Oats Dried Fruit Mix. Category: Food. Material: Organic Oats. Packaging: Paper Box. Manufactured in: USA. Eco Score: 3.4/5. Carbon Footprint Score: 4.5/5. Recyclability Score: 2.1/5. Packaging Score: 2.0/5. Overall Sustainability Index: 71.4/100.
268,Organic Herbs Organic Soap,Personal Care,Organic Herbs,472,95,80,Compostable Bag,None,0.10079847130280488,Kenya,1.9795213214225518,4.568507157464213,3.1,5.0,3.5844085436660293,82.13253980449625,17.82,Product Name: Organic Herbs Organic Soap. Category: Personal Care. Material: Organic Herbs. Packaging: Compostable Bag. Manufactured in: Kenya. Eco Score: 2.0/5. Carbon Footprint Score: 4.6/5. Recyclability Score: 3.1/5. Packaging Score: 5.0/5. Overall Sustainability Index: 82.1/100.
269,Organic Canvas Boots,Footwear,Organic Canvas,2337,4137,95,None,Fair Trade,0.15143656589094381,India,2.457609978088657,2.6615541922290387,3.4,5.0,3.2157492510953087,71.98507630406124,25.24,Product Name: Organic Canvas Boots. Category: Footwear. Material: Organic Canvas. Packaging: None. Manufactured in: India. Eco Score: 2.5/5. Carbon Footprint Score: 2.7/5. Recyclability Score: 3.4/5. Packaging Score: 5.0/5. Overall Sustainability Index: 72.0/100.
270,Bamboo Fiber Solar Powerbank,Electronics,Bamboo Fiber,3479,1070,0,Plastic Film,RoHS,0.5415273322869038,Japan,1.7330187089162312,1.4938650306748469,0.0,1.0,1.1680651218773235,15.621923711960225,82.4,Product Name: Bamboo Fiber Solar Powerbank. Category: Electronics. Material: Bamboo Fiber. Packaging: Plastic Film. Manufactured in: Japan. Eco Score: 1.7/5. Carbon Footprint Score: 1.5/5. Recyclability Score: 0.0/5. Packaging Score: 1.0/5. Overall Sustainability Index: 15.6/100.
271,Tencel Sweater,Apparel,Tencel,1683,3791,95,Glass Jar,GRS,0.7105712140858528,Brazil,0.04508680262936127,3.330265848670757,3.4,3.0,2.2926057953900356,46.575261032314906,107.17,Product Name: Tencel Sweater. Category: Apparel. Material: Tencel. Packaging: Glass Jar. Manufactured in: Brazil. Eco Score: 0.0/5. Carbon Footprint Score: 3.3/5. Recyclability Score: 3.4/5. Packaging Score: 3.0/5. Overall Sustainability Index: 46.6/100.
272,Fair Trade Coffee Dried Fruit Mix,Food,Fair Trade Coffee,75,378,0,Paper Box,USDA Organic,0.0046406879137378025,Japan,1.4079723579976404,4.974437627811861,0.5,2.0,2.41472299574285,49.936575553141154,3.73,Product Name: Fair Trade Coffee Dried Fruit Mix. Category: Food. Material: Fair Trade Coffee. Packaging: Paper Box. Manufactured in: Japan. Eco Score: 1.4/5. Carbon Footprint Score: 5.0/5. Recyclability Score: 0.5/5. Packaging Score: 2.0/5. Overall Sustainability Index: 49.9/100.
